{
  "$name": "Gradr",
  "$description": "Gradr design tokens exported from src/gradr/styles/theme.css.",
  "base": {
    "color": {
      "--color-shell": "#f9f7f6",
      "--color-fog": "#b3c1c6",
      "--color-harbor": "#256074",
      "--color-hull": "#733e24",
      "--color-ink": "#18292f",
      "--color-harbor-soft": "#e7eef1",
      "--color-hull-soft": "#f3e9e3",
      "--color-slate": "#55676d",
      "--color-success": "#2f6b46"
    },
    "typography": {
      "--font-display": "\"Bricolage Grotesque\", ui-sans-serif, system-ui, sans-serif",
      "--font-sans": "\"Geist\", \"Inter\", ui-sans-serif, system-ui, sans-serif",
      "--text-h1": "3.5rem",
      "--text-h1--line-height": "1.05",
      "--text-h1--letter-spacing": "-0.02em",
      "--text-h1--font-weight": "600",
      "--text-h2": "2.25rem",
      "--text-h2--line-height": "1.1",
      "--text-h2--letter-spacing": "-0.015em",
      "--text-h2--font-weight": "600",
      "--text-h3": "1.75rem",
      "--text-h3--line-height": "1.2",
      "--text-h3--letter-spacing": "-0.01em",
      "--text-h3--font-weight": "600",
      "--text-h4": "1.375rem",
      "--text-h4--line-height": "1.3",
      "--text-h4--font-weight": "600",
      "--text-h5": "1.125rem",
      "--text-h5--line-height": "1.4",
      "--text-h5--font-weight": "600",
      "--text-h6": "1rem",
      "--text-h6--line-height": "1.45",
      "--text-h6--font-weight": "600",
      "--text-body-lg": "1.125rem",
      "--text-body-lg--line-height": "1.65",
      "--text-body": "1rem",
      "--text-body--line-height": "1.6",
      "--text-body-sm": "0.875rem",
      "--text-body-sm--line-height": "1.55",
      "--text-caption": "0.8125rem",
      "--text-caption--line-height": "1.45",
      "--text-overline": "0.6875rem",
      "--text-overline--line-height": "1.3",
      "--text-overline--letter-spacing": "0.09em",
      "--text-overline--font-weight": "600",
      "--text-button": "0.875rem",
      "--text-button--line-height": "1",
      "--text-button--letter-spacing": "0.005em",
      "--text-button--font-weight": "500",
      "--text-code": "0.8125rem",
      "--text-code--line-height": "1.5"
    },
    "radius": {
      "--radius-card": "1rem",
      "--radius-control": "0.7rem"
    },
    "shadow": {
      "--shadow-raise": "0 1px 2px rgb(37 96 116 / 0.3), 0 8px 24px -14px rgb(24 41 47 / 0.25)",
      "--shadow-float": "0 2px 4px rgb(24 41 47 / 0.08), 0 20px 40px -20px rgb(24 41 47 / 0.35)"
    },
    "other": {}
  },
  "semantic": {
    "light": {
      "--background": "#f9f7f6",
      "--foreground": "#18292f",
      "--surface": "#ffffff",
      "--surface-muted": "#eeeae8",
      "--border": "#869398",
      "--muted-foreground": "#55676d",
      "--primary": "#256074",
      "--primary-foreground": "#f9f7f6",
      "--accent": "#733e24",
      "--accent-foreground": "#f9f7f6",
      "--destructive": "#8c2f22",
      "--destructive-foreground": "#f9f7f6",
      "--ring": "#256074"
    },
    "dark": {
      "--background": "#10191d",
      "--foreground": "#f9f7f6",
      "--surface": "#18292f",
      "--surface-muted": "#21353c",
      "--border": "#66787e",
      "--muted-foreground": "#b3c1c6",
      "--primary": "#6fb2c8",
      "--primary-foreground": "#0b1417",
      "--accent": "#c8794f",
      "--accent-foreground": "#0b1417",
      "--destructive": "#e2836d",
      "--destructive-foreground": "#0b1417",
      "--ring": "#8fcadd"
    }
  }
}
